survey,name,template
RS,ঢাকা আর এস খতিয়ান,blank.html,26
RS,ঢাকা আর এস খতিয়ানের ইজা পাতা,blank.html,26
CS,ঢাকা সি এস খতিয়ান প্রথমপাতা,blank.html,26
CS,ঢাকা সি এস খতিয়ান প্রথমপাতার ইজাপাতা,blank.html,26
CS,ঢাকা সি এস খতিয়ান দিত্বীয়পাতা,blank.html,26
CS,ঢাকা সি এস খতিয়ান দিত্বীয়পাতার ইজাপাতা,blank.html,26
SA,ঢাকা এস এ খতিয়ান প্রথমপাতা,blank.html,26
SA,ঢাকা এস এ খতিয়ান প্রথমপাতার ইজাপাতা,blank.html,26
SA,ঢাকা এস এ খতিয়ান দিত্বীয়পাতা,blank.html,26
SA,ঢাকা এস এ খতিয়ান দিত্বীয়পাতার ইজাপাতা,blank.html,26
